{
  "$schema": "../../templates/mind-map.schema.json",
  "schema_version": "1.0",
  "domain_slug": "auth",
  "domain_map_rev": 3,
  "generated": "2026-10-21",
  "amended": "2026-10-28",
  "metadata": {
    "scope": "Storefront and Admin sign-in (password, emailed code, MFA second factor, passkeys, external IdP, punchout as a method), organization resolution at sign-in, lockout, Admin entry restriction, API challenge, impersonation, managing one's own sign-in methods (passkey keys, password), sign-out and session termination, password reset, sign-in log. Registration, password policy and org membership mechanics are out, as in the domain map.",
    "built_from": "auth.md rev 2 (§1-§6), BL-AUTH-001..017 (bl:extract --domain auth), suites 031/032/033/082/101/104/105 titles + References + Automation_Status, test models VCST-5748-2026-09-29 and VCST-6132-2026-10-20 Part 0, scripts/seed-data/auth/otp-signin-specs.mjs header, vc-module-mfa#1 / vc-module-otp#3 / vc-frontend#2570 as read for the domain map · UPDATE 2026-10-28 from auth.md rev 3 (Changed since rev 2, §1 links 1-9, §2, §3 D5-D25, §5 G10-G28), suites 110/111 Automated rows with their promoting runs (REG-2026-10-26-1422/1503/1652/1715/1726, all vcst), VCST-5904 round 1 verdict + round 2 checklist/summary + BUG VCST-6506, VCST-6121 vcptcore test-model.md (incl. 3x amendments) + exploratory/SBTM-VCST-6121-2026-10-28.md (run in progress)",
    "kb_read": "2026-10-21 - impersonate grant self/nested: miss; sign-out /connect/logout: hit KB-761B2013; plus the domain-map pass hits KB-06FE6C8D KB-08CC76A3 KB-3CBA0D5F KB-9AF5645D KB-0080ED6D KB-4E1FD1E8 KB-83483C4E KB-262ADDFB KB-8646A9CB KB-C196A782 KB-CC18E96D KB-3466E783 KB-1D5CC609 KB-D42D6CAA KB-6B10CB0E KB-A3E16349 KB-12E99BF8 KB-EF3CB7FB KB-7A4C260E KB-444EF3F4 KB-CA2AE929 KB-675F86C2 KB-9D80EE6B KB-33B89BDD · 2026-10-28 update: opened KB-7EFFA0AD KB-3BF84A5E KB-12E99BF8 KB-CD356AF4 KB-CA7DBAD0 KB-4E12E506 (verify reads, no capture — no live observation in this pass)",
    "not_modelled": "No auth data model exists yet, so requires/produces are omitted; the requirement ids are listed in the build result for /qa-test-data-model build. Suite 101 rows are Draft and decide sign-in-log details below the behaviour level; only rows that decide a node are stamped."
  },
  "nodes": [
    {
      "id": "auth.access",
      "type": "feature",
      "name": "Signing in and account access",
      "status": "CONFIRMED",
      "description": "A visitor establishes an authenticated session by one of several methods, the platform resolves the organization the session acts in, and the session holds until it ends or is refused. Purpose reconstructed in the domain map (UNDECLARED in the guides).",
      "evidence": [
        {
          "class": "OBSERVED",
          "ref": "domain-map:auth@rev2 §1",
          "note": "purpose reconstructed from source + live, both stands",
          "date": "2026-10-21"
        },
        {
          "class": "OBSERVED",
          "ref": "domain-map:auth@rev3 §1",
          "note": "purpose carried; links 8 (manage sign-in methods) and 9 (taking a key away takes access away) added; vcptcore live",
          "date": "2026-10-28"
        }
      ],
      "notes": "integrates with: b2b — organization membership status and lock (BL-B2B-013; b2b-organizations.md); integrates with: store settings — OtpSignIn.Enabled, MultiFactorAuthentication.StoreMode, trustedGroups, authentication types; integrates with: notifications — OtpSignInEmailNotification, MfaSignInEmailNotification; integrates with: ucp — OAuth for agents (ucp.md); integrates with: punchout — the punchout grant (suites 107/108); integrates with: store — per-store authentication schemes, Passkey default on (vc-module-store#190, no mapped domain)"
    },
    {
      "id": "auth.state.account.unlocked",
      "type": "state",
      "name": "Account: not locked out",
      "status": "CONFIRMED",
      "evidence": [
        {
          "class": "OBSERVED",
          "ref": "domain-map:auth@rev2 §1 link 5",
          "note": "LockoutEnd empty; sign-in proceeds",
          "date": "2026-10-21"
        }
      ]
    },
    {
      "id": "auth.state.account.temporarily-locked",
      "type": "state",
      "name": "Account: temporarily locked out after failed attempts",
      "status": "CONFIRMED",
      "evidence": [
        {
          "class": "OBSERVED",
          "ref": "kb:KB-262ADDFB",
          "note": "user_is_temporary_locked_out on the password grant",
          "date": "2026-10-21"
        },
        {
          "class": "OBSERVED",
          "ref": "kb:KB-8646A9CB",
          "note": "five failures lock the account temporarily"
        }
      ]
    },
    {
      "id": "auth.state.account.locked",
      "type": "state",
      "name": "Account: locked by an administrator",
      "status": "CONFIRMED",
      "evidence": [
        {
          "class": "OBSERVED",
          "ref": "kb:KB-1D5CC609",
          "note": "Lock account in the Admin user toolbar",
          "date": "2026-10-21"
        },
        {
          "class": "DOC",
          "ref": "test-data/aliases.json changelog_1_4_5",
          "note": "admin lock persists LockoutEnd 9999-12-31 and /locked returns locked:true",
          "date": "2026-05-14"
        }
      ]
    },
    {
      "id": "auth.state.session.anonymous",
      "type": "state",
      "name": "Session: anonymous",
      "status": "CONFIRMED",
      "evidence": [
        {
          "class": "OBSERVED",
          "ref": "domain-map:auth@rev2 §1 actors",
          "note": "anonymous visitor",
          "date": "2026-10-21"
        }
      ]
    },
    {
      "id": "auth.state.session.signed-in",
      "type": "state",
      "name": "Session: signed in as oneself",
      "status": "CONFIRMED",
      "evidence": [
        {
          "class": "OBSERVED",
          "ref": "domain-map:auth@rev2 §1 link 4",
          "note": "tokens stored client-side, me called, account menu shown",
          "date": "2026-10-21"
        }
      ]
    },
    {
      "id": "auth.state.session.impersonating",
      "type": "state",
      "name": "Session: operator acting as another user",
      "status": "CONFIRMED",
      "evidence": [
        {
          "class": "OBSERVED",
          "ref": "REG-2026-09-07-1342",
          "note": "IMP-010 banner shows operator and target",
          "date": "2026-09-07"
        }
      ]
    },
    {
      "id": "auth.state.session.awaiting-second-factor",
      "type": "state",
      "name": "Session: password accepted, second factor pending",
      "status": "CONFIRMED",
      "evidence": [
        {
          "class": "SPEC",
          "ref": "vc-module-mfa#1",
          "note": "password grant answers two_factor_required with a twoFactorToken",
          "date": "2026-10-19"
        },
        {
          "class": "OBSERVED",
          "ref": "REG-2026-10-26-1652",
          "note": "MFASF-001: password → code step, no session yet (vcst)",
          "date": "2026-10-26"
        },
        {
          "class": "OBSERVED",
          "ref": "VCST-5904",
          "note": "round 2 checklist C1/C2 (vcst-2026-10-23): storefront code step; Backoffice #!/sign-in-code with no session before the code",
          "date": "2026-10-23"
        }
      ]
    },
    {
      "id": "auth.state.otp-code.issued",
      "type": "state",
      "name": "OTP code: issued and unused",
      "status": "CONFIRMED",
      "evidence": [
        {
          "class": "OBSERVED",
          "ref": "domain-map:auth@rev2 §2 API",
          "note": "POST /api/otp/request schedules OtpSignInEmailNotification",
          "date": "2026-10-21"
        }
      ]
    },
    {
      "id": "auth.state.otp-code.used",
      "type": "state",
      "name": "OTP code: used for a sign-in (still valid inside its window)",
      "status": "CONFIRMED",
      "evidence": [
        {
          "class": "OBSERVED",
          "ref": "kb:KB-06FE6C8D",
          "note": "the same code signs in a second time",
          "date": "2026-09-29"
        }
      ]
    },
    {
      "id": "auth.state.otp-code.expired",
      "type": "state",
      "name": "OTP code: past its token-provider lifetime",
      "status": "UNVERIFIED",
      "evidence": [
        {
          "class": "DOC",
          "ref": "reports/ba/test-models/VCST-5748-2026-09-29.md Part 0",
          "note": "state diagram: Issued -> Expired when the window passes; lifetime owned by the Identity Email token provider",
          "date": "2026-09-29"
        }
      ]
    },
    {
      "id": "auth.state.mfa-ticket.issued",
      "type": "state",
      "name": "MFA two-factor token: issued, awaiting a code",
      "status": "CONFIRMED",
      "evidence": [
        {
          "class": "SPEC",
          "ref": "vc-module-mfa#1",
          "note": "DataProtection ticket with user, store, security stamp and provider",
          "date": "2026-10-19"
        },
        {
          "class": "OBSERVED",
          "ref": "REG-2026-10-26-1422",
          "note": "MFA-031, MFA-032: the challenge issues a ticket and one code email (vcst)",
          "date": "2026-10-26"
        }
      ]
    },
    {
      "id": "auth.state.mfa-ticket.redeemed",
      "type": "state",
      "name": "MFA two-factor token: redeemed for tokens",
      "status": "CONFIRMED",
      "evidence": [
        {
          "class": "SPEC",
          "ref": "vc-module-mfa#1",
          "note": "single redemption; a used-code store refuses the same code",
          "date": "2026-10-19"
        },
        {
          "class": "OBSERVED",
          "ref": "REG-2026-10-26-1422",
          "note": "MFA-007: a redeemed ticket is refused invalid_two_factor_token on replay (vcst)",
          "date": "2026-10-26"
        },
        {
          "class": "OBSERVED",
          "ref": "kb:KB-3BF84A5E",
          "note": "a right code redeems the ticket even when the store rule then refuses the sign-in",
          "date": "2026-10-23"